include/mono_init.inc
call mtr.add_suppression("mariadbd: Table 't1' is marked as crashed and should be repaired");
DROP TABLE IF EXISTS t1;
DROP TABLE IF EXISTS t2;
DROP TABLE IF EXISTS t3;
create table t1(i int primary key, j int) engine=eloq;
insert into t1 values(1,1);
insert into t1 values(2,1);
insert into t1 values(3,1);
create table t2(i int primary key, j int) engine=eloq;
insert into t2 values(1,1);
insert into t2 values(2,1);
insert into t2 values(3,1);
select * from t1;
i	j
1	1
2	1
3	1
select * from t2;
i	j
1	1
2	1
3	1
connection serv_2;
begin;
update t1 set j=2 where i=1;
update t2 set j=2 where i=2;
update t1 set j=2 where i=3;
connection serv_1;
begin;
update t2 set j=2 where i=1;
update t1 set j=2 where i=2;
update t2 set j=2 where i=3;
update t1 set j=3 where i=1;
connection serv_2;
update t2 set j=3 where i=3;
connection serv_2;
select * from t1;
i	j
1	2
2	1
3	2
select * from t2;
i	j
1	1
2	2
3	3
commit;
connection serv_1;
ERROR 40001: Deadlock found when trying to get lock; try restarting transaction
select * from t1;
i	j
1	2
2	1
3	2
select * from t2;
i	j
1	1
2	2
3	3
commit;
select * from t1;
i	j
1	2
2	1
3	2
select * from t2;
i	j
1	1
2	2
3	3
drop table t1;
drop table t2;
create table t1(i int primary key, j int) engine=eloq;
insert into t1 values(1,1);
insert into t1 values(2,1);
insert into t1 values(3,1);
insert into t1 values(4,1);
insert into t1 values(5,1);
connection serv_1;
begin;
update t1 set j=2 where i=1;
connection serv_2;
begin;
update t1 set j=2 where i=2;
connection serv_3;
begin;
update t1 set j=2 where i=3;
connection serv_1_1;
begin;
update t1 set j=2 where i=4;
connection serv_2_1;
begin;
update t1 set j=2 where i=5;
connection serv_1;
update t1 set j=3 where i=5;
connection serv_2;
update t1 set j=3 where i=1;
connection serv_3;
update t1 set j=3 where i=2;
connection serv_1_1;
update t1 set j=3 where i=3;
connection serv_2_1;
update t1 set j=3 where i=4;
connection serv_1;
ERROR 40001: Deadlock found when trying to get lock; try restarting transaction
commit;
connection serv_2;
commit;
connection serv_3;
commit;
connection serv_1_1;
commit;
connection serv_2_1;
commit;
select * from t1;
i	j
1	3
2	3
3	3
4	3
5	2
drop table t1;
create table t1(i int primary key, j int) engine=eloq;
insert into t1 values(1,1);
insert into t1 values(2,1);
insert into t1 values(3,1);
connection serv_1;
begin;
update t1 set j=2 where i=1;
connection serv_2;
begin;
update t1 set j=2 where i=2;
connection serv_3;
begin;
update t1 set j=2 where i=3;
connection serv_2;
update t1 set j=3 where i=1;
connection serv_3_1;
SET SESSION debug_dbug="+d,eloq;trigger_dead_lock_detection;node_id=0";
connection serv_1;
commit;
connection serv_2;
commit;
connection serv_3;
commit;
connection serv_1;
select * from t1;
i	j
1	3
2	2
3	2
drop table t1;
create table t1(i int primary key, j int) engine=eloq;
insert into t1 values(1,1);
insert into t1 values(2,1);
insert into t1 values(3,1);
insert into t1 values(4,1);
insert into t1 values(5,1);
insert into t1 values(6,1);
connection serv_1;
begin;
update t1 set j=2 where i<4;
connection serv_2;
begin;
update t1 set j=2 where i>3;
update t1 set j=3 where i<4;
connection serv_1;
update t1 set j=3 where i>3;
connection serv_1;
ERROR 40001: Deadlock found when trying to get lock; try restarting transaction
commit;
connection serv_2;
commit;
connection serv_1;
select * from t1;
i	j
1	3
2	3
3	3
4	2
5	2
6	2
drop table t1;
