set @@default_storage_engine= eloq;
select @@default_storage_engine;
@@default_storage_engine
ELOQ
DROP TABLE IF EXISTS t1;
SET SESSION debug_dbug="+d,eloq;checkpointer_skip_ckpt;node_id=-1";
SET SESSION debug_dbug="+d,eloq;stop_safely_clean_archives;";
create table t1(i int primary key, j int) engine= eloq;
insert into t1 values(1,1);
insert into t1 values(2,2);
insert into t1 values(3,3);
insert into t1 values(5,5);
insert into t1 values(7,7);
insert into t1 values(8,8);
select * from t1 where i<3;
i	j
1	1
2	2
select * from t1 where i<=3;
i	j
1	1
2	2
3	3
select * from t1 where i>5;
i	j
7	7
8	8
select * from t1 where i>=5;
i	j
5	5
7	7
8	8
select * from t1;
i	j
1	1
2	2
3	3
5	5
7	7
8	8
set session transaction isolation level repeatable read;
select @@tx_isolation;
@@tx_isolation
REPEATABLE-READ
connect  conn-tx1,localhost,root,,test,$MONO1_PORT;
set session transaction isolation level repeatable read;
select @@tx_isolation;
@@tx_isolation
REPEATABLE-READ
begin;
select * from t1 where i<3;
i	j
1	1
2	2
select * from t1 where i<=3;
i	j
1	1
2	2
3	3
select * from t1 where i>5;
i	j
7	7
8	8
select * from t1 where i>=5;
i	j
5	5
7	7
8	8
select * from t1;
i	j
1	1
2	2
3	3
5	5
7	7
8	8
connection default;
update t1 set j=21;
update t1 set j=22;
delete from t1 where i=1;
update t1 set j=23 where i=3;
update t1 set j=25 where i=5;
delete from t1 where i=7;
insert into t1 values(9,29);
select * from t1;
i	j
2	22
3	23
5	25
8	22
9	29
connection conn-tx1;
select * from t1 where i<3;
i	j
1	1
2	2
select * from t1 where i<=3;
i	j
1	1
2	2
3	3
select * from t1 where i>5;
i	j
7	7
8	8
select * from t1 where i>=5;
i	j
5	5
7	7
8	8
select * from t1;
i	j
1	1
2	2
3	3
5	5
7	7
8	8
connection default;
SET SESSION debug_dbug="+d,eloq_test;ccentry_clean_test;./test/t1;1;";
SET SESSION debug_dbug="+d,eloq_test;ccentry_clean_test;./test/t1;7;";
SET SESSION debug_dbug="+d,eloq_test;ccentry_clean_test;./test/t1;3;";
select * from t1;
i	j
2	22
3	23
5	25
8	22
9	29
connection conn-tx1;
select * from t1 where i<3;
i	j
1	1
2	2
select * from t1 where i<=3;
i	j
1	1
2	2
3	3
select * from t1 where i>5;
i	j
7	7
8	8
select * from t1 where i>=5;
i	j
5	5
7	7
8	8
select * from t1;
i	j
1	1
2	2
3	3
5	5
7	7
8	8
commit;
select * from t1;
i	j
2	22
3	23
5	25
8	22
9	29
update t1 set j=30;
connection conn-tx1;
set session transaction isolation level read committed;
select @@tx_isolation;
@@tx_isolation
READ-COMMITTED
begin;
select * from t1 where i<3;
i	j
2	30
select * from t1 where i<=3;
i	j
2	30
3	30
select * from t1 where i>5;
i	j
8	30
9	30
select * from t1 where i>=5;
i	j
5	30
8	30
9	30
select * from t1;
i	j
2	30
3	30
5	30
8	30
9	30
connection default;
set session transaction isolation level read committed;
select @@tx_isolation;
@@tx_isolation
READ-COMMITTED
delete from t1 where i=2;
delete from t1 where i=5;
update t1 set j=33 where i=3;
update t1 set j=38 where i=8;
select * from t1;
i	j
3	33
8	38
9	30
connection conn-tx1;
select * from t1 where i<3;
i	j
select * from t1 where i<=3;
i	j
3	33
select * from t1 where i>5;
i	j
8	38
9	30
select * from t1 where i>=5;
i	j
8	38
9	30
select * from t1;
i	j
3	33
8	38
9	30
connection default;
SET SESSION debug_dbug="+d,eloq_test;ccentry_clean_test;./test/t1;2;";
SET SESSION debug_dbug="+d,eloq_test;ccentry_clean_test;./test/t1;5;";
connection conn-tx1;
select * from t1 where i<3;
i	j
select * from t1 where i<=3;
i	j
3	33
select * from t1 where i>5;
i	j
8	38
9	30
select * from t1 where i>=5;
i	j
8	38
9	30
select * from t1;
i	j
3	33
8	38
9	30
commit;
SET SESSION debug_dbug="-d,eloq;stop_safely_clean_archives;";
SET SESSION debug_dbug="-d,eloq;checkpointer_skip_ckpt;node_id=-1";
drop table t1;
