set @@default_storage_engine= eloq;
select @@default_storage_engine;
@@default_storage_engine
ELOQ
DROP TABLE IF EXISTS t1;
create table t1(a int primary key, b int , c int, index(b)) engine= eloq;
insert into t1 values(1,1,1);
insert into t1 values(2,2,2);
insert into t1 values(3,3,3);
insert into t1 values(4,4,4);
insert into t1 values(5,5,5);
insert into t1 values(6,6,6);
insert into t1 values(7,7,7);
SET SESSION debug_dbug="+d,eloq;at_once;node_id=-1;action=NOTIFY_CHECKPOINTER";
SET SESSION debug_dbug="+d,eloq;stop_safely_clean_archives;";
select * from t1;
a	b	c
1	1	1
2	2	2
3	3	3
4	4	4
5	5	5
6	6	6
7	7	7
set session transaction isolation level repeatable read;
select @@tx_isolation;
@@tx_isolation
REPEATABLE-READ
connect  conn-tx1,localhost,root,,test,$MONO1_PORT;
set session transaction isolation level repeatable read;
select @@tx_isolation;
@@tx_isolation
REPEATABLE-READ
begin;
select b from t1 where b=1;
b
1
select b from t1 where b<3;
b
1
2
select b from t1 where b<=3;
b
1
2
3
select b from t1 where b>5;
b
6
7
select b from t1 where b>=5;
b
5
6
7
select b from t1 where b>=0;
b
1
2
3
4
5
6
7
select * from t1 where b=1;
a	b	c
1	1	1
select * from t1 where b<3;
a	b	c
1	1	1
2	2	2
select * from t1 where b<=3;
a	b	c
1	1	1
2	2	2
3	3	3
select * from t1 where b>5;
a	b	c
6	6	6
7	7	7
select * from t1 where b>=5;
a	b	c
5	5	5
6	6	6
7	7	7
select * from t1 where b>0;
a	b	c
1	1	1
2	2	2
3	3	3
4	4	4
5	5	5
6	6	6
7	7	7
connection default;
update t1 set b=10;
update t1 set b=1;
update t1 set b=2;
update t1 set b=3;
update t1 set b=6;
update t1 set b=2;
update t1 set b=1;
insert into t1 values(8,8,8);
delete from t1 where a=1;
select b from t1 where b>0;
b
1
1
1
1
1
1
8
select * from t1 where b>0;
a	b	c
2	1	2
3	1	3
4	1	4
5	1	5
6	1	6
7	1	7
8	8	8
select * from t1;
a	b	c
2	1	2
3	1	3
4	1	4
5	1	5
6	1	6
7	1	7
8	8	8
connection conn-tx1;
select b from t1 where b=1;
b
1
select b from t1 where b<3;
b
1
2
select b from t1 where b<=3;
b
1
2
3
select b from t1 where b>5;
b
6
7
select b from t1 where b>=5;
b
5
6
7
select b from t1 where b>=0;
b
1
2
3
4
5
6
7
select * from t1 where b=1;
a	b	c
1	1	1
select * from t1 where b<3;
a	b	c
1	1	1
2	2	2
select * from t1 where b<=3;
a	b	c
1	1	1
2	2	2
3	3	3
select * from t1 where b>5;
a	b	c
6	6	6
7	7	7
select * from t1 where b>=5;
a	b	c
5	5	5
6	6	6
7	7	7
select * from t1 where b>0;
a	b	c
1	1	1
2	2	2
3	3	3
4	4	4
5	5	5
6	6	6
7	7	7
connection default;
SET SESSION debug_dbug="+d,eloq_test;sk_archives_clean_test;./test/t1;b;1;1;";
SET SESSION debug_dbug="+d,eloq_test;sk_archives_clean_test;./test/t1;b;2;2;";
SET SESSION debug_dbug="+d,eloq_test;sk_archives_clean_test;./test/t1;b;3;3;";
SET SESSION debug_dbug="+d,eloq_test;sk_archives_clean_test;./test/t1;b;6;6;";
connection conn-tx1;
select b from t1 where b=1;
b
1
select b from t1 where b<3;
b
1
2
select b from t1 where b<=3;
b
1
2
3
select b from t1 where b>5;
b
6
7
select b from t1 where b>=5;
b
5
6
7
select b from t1 where b>=0;
b
1
2
3
4
5
6
7
select * from t1 where b=1;
a	b	c
1	1	1
select * from t1 where b<3;
a	b	c
1	1	1
2	2	2
select * from t1 where b<=3;
a	b	c
1	1	1
2	2	2
3	3	3
select * from t1 where b>5;
a	b	c
6	6	6
7	7	7
select * from t1 where b>=5;
a	b	c
5	5	5
6	6	6
7	7	7
select * from t1 where b>0;
a	b	c
1	1	1
2	2	2
3	3	3
4	4	4
5	5	5
6	6	6
7	7	7
connection default;
SET SESSION debug_dbug="+d,eloq_test;sk_ccentry_clean_test;./test/t1;b;5;5;";
SET SESSION debug_dbug="+d,eloq_test;sk_ccentry_clean_test;./test/t1;b;1;1;";
SET SESSION debug_dbug="+d,eloq_test;sk_ccentry_clean_test;./test/t1;b;2;2;";
SET SESSION debug_dbug="+d,eloq_test;sk_ccentry_clean_test;./test/t1;b;6;6;";
connection conn-tx1;
select b from t1 where b=1;
b
1
select b from t1 where b<3;
b
1
2
select b from t1 where b<=3;
b
1
2
3
select b from t1 where b>5;
b
6
7
select b from t1 where b>=5;
b
5
6
7
select b from t1 where b>=0;
b
1
2
3
4
5
6
7
select * from t1 where b=1;
a	b	c
1	1	1
select * from t1 where b<3;
a	b	c
1	1	1
2	2	2
select * from t1 where b<=3;
a	b	c
1	1	1
2	2	2
3	3	3
select * from t1 where b>5;
a	b	c
6	6	6
7	7	7
select * from t1 where b>=5;
a	b	c
5	5	5
6	6	6
7	7	7
select * from t1 where b>0;
a	b	c
1	1	1
2	2	2
3	3	3
4	4	4
5	5	5
6	6	6
7	7	7
commit;
select b from t1 where b>0;
b
1
1
1
1
1
1
8
select * from t1 where b>0;
a	b	c
2	1	2
3	1	3
4	1	4
5	1	5
6	1	6
7	1	7
8	8	8
drop table t1;
SET SESSION debug_dbug="-d,eloq;stop_safely_clean_archives;";
