call mtr.add_suppression("mariadbd: Table 't3' is marked as crashed and should be repaired");
call mtr.add_suppression("mariadbd: Table 't2' is marked as crashed and should be repaired");
DROP TABLE IF EXISTS t1;
DROP TABLE IF EXISTS t2;
DROP TABLE IF EXISTS t3;
create table t1(i int primary key, j int) engine=eloq;
insert into t1 values(1,1);
insert into t1 values(2,1);
insert into t1 values(3,1);
create table t2(i int primary key, j int) engine=eloq;
insert into t2 values(1,1);
insert into t2 values(2,1);
insert into t2 values(3,1);
select * from t1;
i	j
1	1
2	1
3	1
select * from t2;
i	j
1	1
2	1
3	1
connect  con_1,localhost,root,,test,$MONO1_PORT;
begin;
update t1 set j=2 where i=1;
update t2 set j=2 where i=2;
update t1 set j=2 where i=3;
connection default;
begin;
update t2 set j=2 where i=1;
update t1 set j=2 where i=2;
update t2 set j=2 where i=3;
update t1 set j=3 where i=1;
connection con_1;
update t2 set j=3 where i=1;
connection con_1;
ERROR 40001: Deadlock found when trying to get lock; try restarting transaction
select * from t1;
i	j
1	1
2	1
3	1
select * from t2;
i	j
1	1
2	1
3	1
commit;
connection default;
select * from t1;
i	j
1	3
2	2
3	1
select * from t2;
i	j
1	2
2	1
3	2
commit;
select * from t1;
i	j
1	3
2	2
3	1
select * from t2;
i	j
1	2
2	1
3	2
drop table t1;
drop table t2;
create table t3(i int primary key, j int) engine=eloq;
insert into t3 values(1,1);
insert into t3 values(2,1);
insert into t3 values(3,1);
connect  con1,localhost,root,,test,$MONO1_PORT;
begin;
update t3 set j=2 where i=1;
connect  con2,localhost,root,,test,$MONO1_PORT;
begin;
update t3 set j=2 where i=2;
connect  con3,localhost,root,,test,$MONO1_PORT;
begin;
update t3 set j=2 where i=3;
connection con1;
update t3 set j=3 where i=3;
connection con2;
update t3 set j=3 where i=1;
connection con3;
update t3 set j=3 where i=2;
connection con1;
ERROR 40001: Deadlock found when trying to get lock; try restarting transaction
commit;
connection con2;
commit;
connection con3;
commit;
connection default;
select * from t3;
i	j
1	3
2	3
3	2
drop table t3;
create table t1(i int primary key, j int) engine=eloq;
insert into t1 values(1,1);
insert into t1 values(2,1);
insert into t1 values(3,1);
connection con1;
begin;
update t1 set j=2 where i=1;
connection con2;
begin;
update t1 set j=2 where i=2;
connection con3;
begin;
update t1 set j=2 where i=3;
connection con2;
update t1 set j=3 where i=1;
connection default;
SET SESSION debug_dbug="+d,eloq;trigger_dead_lock_detection;node_id=0";
connection con1;
commit;
connection con2;
commit;
connection con3;
commit;
connection default;
select * from t1;
i	j
1	3
2	2
3	2
drop table t1;
