include/mono_init.inc
create table t1(i varchar(12) primary key, j int, k int, key(j)) engine= eloq;
insert into t1 values('a', 91, 92);
insert into t1 values('b1', 81, 82);
insert into t1 values('c12', 71, 72);
insert into t1 values('d123', 61, 62);
insert into t1 values('e1234', 51, 52);
insert into t1 values('f12345', 41, 42);
insert into t1 values('g123456', 31, 32);
insert into t1 values('h1234567', 21, 22);
insert into t1 values('j12345678', 11, 12);
insert into t1 values('k123456789', 1, 2);
select * from t1 where j=41;
i	j	k
f12345	41	42
select * from t1 where j>40 and j<70;
i	j	k
f12345	41	42
e1234	51	52
d123	61	62
connection serv_2;
select * from t1 where j=41;
i	j	k
f12345	41	42
select * from t1 where j>40 and j<70;
i	j	k
f12345	41	42
e1234	51	52
d123	61	62
begin;
update t1 set j=35 where i='g123456';
select * from t1 where j=41;
i	j	k
f12345	41	42
select * from t1 where j>40 and j<70;
i	j	k
f12345	41	42
e1234	51	52
d123	61	62
connection serv_1;
select * from t1 where j=41;
i	j	k
f12345	41	42
select * from t1 where j>40 and j<70;
i	j	k
f12345	41	42
e1234	51	52
d123	61	62
connection serv_2;
commit;
select * from t1 where j=41;
i	j	k
f12345	41	42
select * from t1 where j>40 and j<70;
i	j	k
f12345	41	42
e1234	51	52
d123	61	62
connection serv_1;
select * from t1 where j=41;
i	j	k
f12345	41	42
select * from t1 where j>40 and j<70;
i	j	k
f12345	41	42
e1234	51	52
d123	61	62
set optimizer_switch='mrr=on,mrr_sort_keys=on';
select * from t1 where j=41;
i	j	k
f12345	41	42
select * from t1 where j>40 and j<70;
i	j	k
d123	61	62
e1234	51	52
f12345	41	42
connection serv_2;
set optimizer_switch='mrr=on,mrr_sort_keys=on';
select * from t1 where j=41;
i	j	k
f12345	41	42
select * from t1 where j>40 and j<70;
i	j	k
d123	61	62
e1234	51	52
f12345	41	42
drop table t1;
connection serv_1;
set optimizer_switch='mrr=off,mrr_sort_keys=off';
create table t2(f1 varchar(100) primary key, f2 int, f3 int, f4 varchar(100), key(f2,f3)) engine= eloq;
select * from t2 where f2>8000 and f3<10;
f1	f2	f3	f4
test_9991 abcdefghijklmnopqrstuvwxyz	9991	9	test_9991 abcdefghijklmnopqrstuvwxyz1234567890
test_9992 abcdefghijklmnopqrstuvwxyz	9992	8	test_9992 abcdefghijklmnopqrstuvwxyz1234567890
test_9993 abcdefghijklmnopqrstuvwxyz	9993	7	test_9993 abcdefghijklmnopqrstuvwxyz1234567890
test_9994 abcdefghijklmnopqrstuvwxyz	9994	6	test_9994 abcdefghijklmnopqrstuvwxyz1234567890
test_9995 abcdefghijklmnopqrstuvwxyz	9995	5	test_9995 abcdefghijklmnopqrstuvwxyz1234567890
test_9996 abcdefghijklmnopqrstuvwxyz	9996	4	test_9996 abcdefghijklmnopqrstuvwxyz1234567890
test_9997 abcdefghijklmnopqrstuvwxyz	9997	3	test_9997 abcdefghijklmnopqrstuvwxyz1234567890
test_9998 abcdefghijklmnopqrstuvwxyz	9998	2	test_9998 abcdefghijklmnopqrstuvwxyz1234567890
test_9999 abcdefghijklmnopqrstuvwxyz	9999	1	test_9999 abcdefghijklmnopqrstuvwxyz1234567890
select * from t2 where f2>8000 and f3%10=1;
f1	f2	f3	f4
test_8009 abcdefghijklmnopqrstuvwxyz	8009	1991	test_8009 abcdefghijklmnopqrstuvwxyz1234567890
test_8019 abcdefghijklmnopqrstuvwxyz	8019	1981	test_8019 abcdefghijklmnopqrstuvwxyz1234567890
test_8029 abcdefghijklmnopqrstuvwxyz	8029	1971	test_8029 abcdefghijklmnopqrstuvwxyz1234567890
test_8039 abcdefghijklmnopqrstuvwxyz	8039	1961	test_8039 abcdefghijklmnopqrstuvwxyz1234567890
test_8049 abcdefghijklmnopqrstuvwxyz	8049	1951	test_8049 abcdefghijklmnopqrstuvwxyz1234567890
test_8059 abcdefghijklmnopqrstuvwxyz	8059	1941	test_8059 abcdefghijklmnopqrstuvwxyz1234567890
test_8069 abcdefghijklmnopqrstuvwxyz	8069	1931	test_8069 abcdefghijklmnopqrstuvwxyz1234567890
test_8079 abcdefghijklmnopqrstuvwxyz	8079	1921	test_8079 abcdefghijklmnopqrstuvwxyz1234567890
test_8089 abcdefghijklmnopqrstuvwxyz	8089	1911	test_8089 abcdefghijklmnopqrstuvwxyz1234567890
test_8099 abcdefghijklmnopqrstuvwxyz	8099	1901	test_8099 abcdefghijklmnopqrstuvwxyz1234567890
test_8109 abcdefghijklmnopqrstuvwxyz	8109	1891	test_8109 abcdefghijklmnopqrstuvwxyz1234567890
test_8119 abcdefghijklmnopqrstuvwxyz	8119	1881	test_8119 abcdefghijklmnopqrstuvwxyz1234567890
test_8129 abcdefghijklmnopqrstuvwxyz	8129	1871	test_8129 abcdefghijklmnopqrstuvwxyz1234567890
test_8139 abcdefghijklmnopqrstuvwxyz	8139	1861	test_8139 abcdefghijklmnopqrstuvwxyz1234567890
test_8149 abcdefghijklmnopqrstuvwxyz	8149	1851	test_8149 abcdefghijklmnopqrstuvwxyz1234567890
test_8159 abcdefghijklmnopqrstuvwxyz	8159	1841	test_8159 abcdefghijklmnopqrstuvwxyz1234567890
test_8169 abcdefghijklmnopqrstuvwxyz	8169	1831	test_8169 abcdefghijklmnopqrstuvwxyz1234567890
test_8179 abcdefghijklmnopqrstuvwxyz	8179	1821	test_8179 abcdefghijklmnopqrstuvwxyz1234567890
test_8189 abcdefghijklmnopqrstuvwxyz	8189	1811	test_8189 abcdefghijklmnopqrstuvwxyz1234567890
test_8199 abcdefghijklmnopqrstuvwxyz	8199	1801	test_8199 abcdefghijklmnopqrstuvwxyz1234567890
test_8209 abcdefghijklmnopqrstuvwxyz	8209	1791	test_8209 abcdefghijklmnopqrstuvwxyz1234567890
test_8219 abcdefghijklmnopqrstuvwxyz	8219	1781	test_8219 abcdefghijklmnopqrstuvwxyz1234567890
test_8229 abcdefghijklmnopqrstuvwxyz	8229	1771	test_8229 abcdefghijklmnopqrstuvwxyz1234567890
test_8239 abcdefghijklmnopqrstuvwxyz	8239	1761	test_8239 abcdefghijklmnopqrstuvwxyz1234567890
test_8249 abcdefghijklmnopqrstuvwxyz	8249	1751	test_8249 abcdefghijklmnopqrstuvwxyz1234567890
test_8259 abcdefghijklmnopqrstuvwxyz	8259	1741	test_8259 abcdefghijklmnopqrstuvwxyz1234567890
test_8269 abcdefghijklmnopqrstuvwxyz	8269	1731	test_8269 abcdefghijklmnopqrstuvwxyz1234567890
test_8279 abcdefghijklmnopqrstuvwxyz	8279	1721	test_8279 abcdefghijklmnopqrstuvwxyz1234567890
test_8289 abcdefghijklmnopqrstuvwxyz	8289	1711	test_8289 abcdefghijklmnopqrstuvwxyz1234567890
test_8299 abcdefghijklmnopqrstuvwxyz	8299	1701	test_8299 abcdefghijklmnopqrstuvwxyz1234567890
test_8309 abcdefghijklmnopqrstuvwxyz	8309	1691	test_8309 abcdefghijklmnopqrstuvwxyz1234567890
test_8319 abcdefghijklmnopqrstuvwxyz	8319	1681	test_8319 abcdefghijklmnopqrstuvwxyz1234567890
test_8329 abcdefghijklmnopqrstuvwxyz	8329	1671	test_8329 abcdefghijklmnopqrstuvwxyz1234567890
test_8339 abcdefghijklmnopqrstuvwxyz	8339	1661	test_8339 abcdefghijklmnopqrstuvwxyz1234567890
test_8349 abcdefghijklmnopqrstuvwxyz	8349	1651	test_8349 abcdefghijklmnopqrstuvwxyz1234567890
test_8359 abcdefghijklmnopqrstuvwxyz	8359	1641	test_8359 abcdefghijklmnopqrstuvwxyz1234567890
test_8369 abcdefghijklmnopqrstuvwxyz	8369	1631	test_8369 abcdefghijklmnopqrstuvwxyz1234567890
test_8379 abcdefghijklmnopqrstuvwxyz	8379	1621	test_8379 abcdefghijklmnopqrstuvwxyz1234567890
test_8389 abcdefghijklmnopqrstuvwxyz	8389	1611	test_8389 abcdefghijklmnopqrstuvwxyz1234567890
test_8399 abcdefghijklmnopqrstuvwxyz	8399	1601	test_8399 abcdefghijklmnopqrstuvwxyz1234567890
test_8409 abcdefghijklmnopqrstuvwxyz	8409	1591	test_8409 abcdefghijklmnopqrstuvwxyz1234567890
test_8419 abcdefghijklmnopqrstuvwxyz	8419	1581	test_8419 abcdefghijklmnopqrstuvwxyz1234567890
test_8429 abcdefghijklmnopqrstuvwxyz	8429	1571	test_8429 abcdefghijklmnopqrstuvwxyz1234567890
test_8439 abcdefghijklmnopqrstuvwxyz	8439	1561	test_8439 abcdefghijklmnopqrstuvwxyz1234567890
test_8449 abcdefghijklmnopqrstuvwxyz	8449	1551	test_8449 abcdefghijklmnopqrstuvwxyz1234567890
test_8459 abcdefghijklmnopqrstuvwxyz	8459	1541	test_8459 abcdefghijklmnopqrstuvwxyz1234567890
test_8469 abcdefghijklmnopqrstuvwxyz	8469	1531	test_8469 abcdefghijklmnopqrstuvwxyz1234567890
test_8479 abcdefghijklmnopqrstuvwxyz	8479	1521	test_8479 abcdefghijklmnopqrstuvwxyz1234567890
test_8489 abcdefghijklmnopqrstuvwxyz	8489	1511	test_8489 abcdefghijklmnopqrstuvwxyz1234567890
test_8499 abcdefghijklmnopqrstuvwxyz	8499	1501	test_8499 abcdefghijklmnopqrstuvwxyz1234567890
test_8509 abcdefghijklmnopqrstuvwxyz	8509	1491	test_8509 abcdefghijklmnopqrstuvwxyz1234567890
test_8519 abcdefghijklmnopqrstuvwxyz	8519	1481	test_8519 abcdefghijklmnopqrstuvwxyz1234567890
test_8529 abcdefghijklmnopqrstuvwxyz	8529	1471	test_8529 abcdefghijklmnopqrstuvwxyz1234567890
test_8539 abcdefghijklmnopqrstuvwxyz	8539	1461	test_8539 abcdefghijklmnopqrstuvwxyz1234567890
test_8549 abcdefghijklmnopqrstuvwxyz	8549	1451	test_8549 abcdefghijklmnopqrstuvwxyz1234567890
test_8559 abcdefghijklmnopqrstuvwxyz	8559	1441	test_8559 abcdefghijklmnopqrstuvwxyz1234567890
test_8569 abcdefghijklmnopqrstuvwxyz	8569	1431	test_8569 abcdefghijklmnopqrstuvwxyz1234567890
test_8579 abcdefghijklmnopqrstuvwxyz	8579	1421	test_8579 abcdefghijklmnopqrstuvwxyz1234567890
test_8589 abcdefghijklmnopqrstuvwxyz	8589	1411	test_8589 abcdefghijklmnopqrstuvwxyz1234567890
test_8599 abcdefghijklmnopqrstuvwxyz	8599	1401	test_8599 abcdefghijklmnopqrstuvwxyz1234567890
test_8609 abcdefghijklmnopqrstuvwxyz	8609	1391	test_8609 abcdefghijklmnopqrstuvwxyz1234567890
test_8619 abcdefghijklmnopqrstuvwxyz	8619	1381	test_8619 abcdefghijklmnopqrstuvwxyz1234567890
test_8629 abcdefghijklmnopqrstuvwxyz	8629	1371	test_8629 abcdefghijklmnopqrstuvwxyz1234567890
test_8639 abcdefghijklmnopqrstuvwxyz	8639	1361	test_8639 abcdefghijklmnopqrstuvwxyz1234567890
test_8649 abcdefghijklmnopqrstuvwxyz	8649	1351	test_8649 abcdefghijklmnopqrstuvwxyz1234567890
test_8659 abcdefghijklmnopqrstuvwxyz	8659	1341	test_8659 abcdefghijklmnopqrstuvwxyz1234567890
test_8669 abcdefghijklmnopqrstuvwxyz	8669	1331	test_8669 abcdefghijklmnopqrstuvwxyz1234567890
test_8679 abcdefghijklmnopqrstuvwxyz	8679	1321	test_8679 abcdefghijklmnopqrstuvwxyz1234567890
test_8689 abcdefghijklmnopqrstuvwxyz	8689	1311	test_8689 abcdefghijklmnopqrstuvwxyz1234567890
test_8699 abcdefghijklmnopqrstuvwxyz	8699	1301	test_8699 abcdefghijklmnopqrstuvwxyz1234567890
test_8709 abcdefghijklmnopqrstuvwxyz	8709	1291	test_8709 abcdefghijklmnopqrstuvwxyz1234567890
test_8719 abcdefghijklmnopqrstuvwxyz	8719	1281	test_8719 abcdefghijklmnopqrstuvwxyz1234567890
test_8729 abcdefghijklmnopqrstuvwxyz	8729	1271	test_8729 abcdefghijklmnopqrstuvwxyz1234567890
test_8739 abcdefghijklmnopqrstuvwxyz	8739	1261	test_8739 abcdefghijklmnopqrstuvwxyz1234567890
test_8749 abcdefghijklmnopqrstuvwxyz	8749	1251	test_8749 abcdefghijklmnopqrstuvwxyz1234567890
test_8759 abcdefghijklmnopqrstuvwxyz	8759	1241	test_8759 abcdefghijklmnopqrstuvwxyz1234567890
test_8769 abcdefghijklmnopqrstuvwxyz	8769	1231	test_8769 abcdefghijklmnopqrstuvwxyz1234567890
test_8779 abcdefghijklmnopqrstuvwxyz	8779	1221	test_8779 abcdefghijklmnopqrstuvwxyz1234567890
test_8789 abcdefghijklmnopqrstuvwxyz	8789	1211	test_8789 abcdefghijklmnopqrstuvwxyz1234567890
test_8799 abcdefghijklmnopqrstuvwxyz	8799	1201	test_8799 abcdefghijklmnopqrstuvwxyz1234567890
test_8809 abcdefghijklmnopqrstuvwxyz	8809	1191	test_8809 abcdefghijklmnopqrstuvwxyz1234567890
test_8819 abcdefghijklmnopqrstuvwxyz	8819	1181	test_8819 abcdefghijklmnopqrstuvwxyz1234567890
test_8829 abcdefghijklmnopqrstuvwxyz	8829	1171	test_8829 abcdefghijklmnopqrstuvwxyz1234567890
test_8839 abcdefghijklmnopqrstuvwxyz	8839	1161	test_8839 abcdefghijklmnopqrstuvwxyz1234567890
test_8849 abcdefghijklmnopqrstuvwxyz	8849	1151	test_8849 abcdefghijklmnopqrstuvwxyz1234567890
test_8859 abcdefghijklmnopqrstuvwxyz	8859	1141	test_8859 abcdefghijklmnopqrstuvwxyz1234567890
test_8869 abcdefghijklmnopqrstuvwxyz	8869	1131	test_8869 abcdefghijklmnopqrstuvwxyz1234567890
test_8879 abcdefghijklmnopqrstuvwxyz	8879	1121	test_8879 abcdefghijklmnopqrstuvwxyz1234567890
test_8889 abcdefghijklmnopqrstuvwxyz	8889	1111	test_8889 abcdefghijklmnopqrstuvwxyz1234567890
test_8899 abcdefghijklmnopqrstuvwxyz	8899	1101	test_8899 abcdefghijklmnopqrstuvwxyz1234567890
test_8909 abcdefghijklmnopqrstuvwxyz	8909	1091	test_8909 abcdefghijklmnopqrstuvwxyz1234567890
test_8919 abcdefghijklmnopqrstuvwxyz	8919	1081	test_8919 abcdefghijklmnopqrstuvwxyz1234567890
test_8929 abcdefghijklmnopqrstuvwxyz	8929	1071	test_8929 abcdefghijklmnopqrstuvwxyz1234567890
test_8939 abcdefghijklmnopqrstuvwxyz	8939	1061	test_8939 abcdefghijklmnopqrstuvwxyz1234567890
test_8949 abcdefghijklmnopqrstuvwxyz	8949	1051	test_8949 abcdefghijklmnopqrstuvwxyz1234567890
test_8959 abcdefghijklmnopqrstuvwxyz	8959	1041	test_8959 abcdefghijklmnopqrstuvwxyz1234567890
test_8969 abcdefghijklmnopqrstuvwxyz	8969	1031	test_8969 abcdefghijklmnopqrstuvwxyz1234567890
test_8979 abcdefghijklmnopqrstuvwxyz	8979	1021	test_8979 abcdefghijklmnopqrstuvwxyz1234567890
test_8989 abcdefghijklmnopqrstuvwxyz	8989	1011	test_8989 abcdefghijklmnopqrstuvwxyz1234567890
test_8999 abcdefghijklmnopqrstuvwxyz	8999	1001	test_8999 abcdefghijklmnopqrstuvwxyz1234567890
test_9009 abcdefghijklmnopqrstuvwxyz	9009	991	test_9009 abcdefghijklmnopqrstuvwxyz1234567890
test_9019 abcdefghijklmnopqrstuvwxyz	9019	981	test_9019 abcdefghijklmnopqrstuvwxyz1234567890
test_9029 abcdefghijklmnopqrstuvwxyz	9029	971	test_9029 abcdefghijklmnopqrstuvwxyz1234567890
test_9039 abcdefghijklmnopqrstuvwxyz	9039	961	test_9039 abcdefghijklmnopqrstuvwxyz1234567890
test_9049 abcdefghijklmnopqrstuvwxyz	9049	951	test_9049 abcdefghijklmnopqrstuvwxyz1234567890
test_9059 abcdefghijklmnopqrstuvwxyz	9059	941	test_9059 abcdefghijklmnopqrstuvwxyz1234567890
test_9069 abcdefghijklmnopqrstuvwxyz	9069	931	test_9069 abcdefghijklmnopqrstuvwxyz1234567890
test_9079 abcdefghijklmnopqrstuvwxyz	9079	921	test_9079 abcdefghijklmnopqrstuvwxyz1234567890
test_9089 abcdefghijklmnopqrstuvwxyz	9089	911	test_9089 abcdefghijklmnopqrstuvwxyz1234567890
test_9099 abcdefghijklmnopqrstuvwxyz	9099	901	test_9099 abcdefghijklmnopqrstuvwxyz1234567890
test_9109 abcdefghijklmnopqrstuvwxyz	9109	891	test_9109 abcdefghijklmnopqrstuvwxyz1234567890
test_9119 abcdefghijklmnopqrstuvwxyz	9119	881	test_9119 abcdefghijklmnopqrstuvwxyz1234567890
test_9129 abcdefghijklmnopqrstuvwxyz	9129	871	test_9129 abcdefghijklmnopqrstuvwxyz1234567890
test_9139 abcdefghijklmnopqrstuvwxyz	9139	861	test_9139 abcdefghijklmnopqrstuvwxyz1234567890
test_9149 abcdefghijklmnopqrstuvwxyz	9149	851	test_9149 abcdefghijklmnopqrstuvwxyz1234567890
test_9159 abcdefghijklmnopqrstuvwxyz	9159	841	test_9159 abcdefghijklmnopqrstuvwxyz1234567890
test_9169 abcdefghijklmnopqrstuvwxyz	9169	831	test_9169 abcdefghijklmnopqrstuvwxyz1234567890
test_9179 abcdefghijklmnopqrstuvwxyz	9179	821	test_9179 abcdefghijklmnopqrstuvwxyz1234567890
test_9189 abcdefghijklmnopqrstuvwxyz	9189	811	test_9189 abcdefghijklmnopqrstuvwxyz1234567890
test_9199 abcdefghijklmnopqrstuvwxyz	9199	801	test_9199 abcdefghijklmnopqrstuvwxyz1234567890
test_9209 abcdefghijklmnopqrstuvwxyz	9209	791	test_9209 abcdefghijklmnopqrstuvwxyz1234567890
test_9219 abcdefghijklmnopqrstuvwxyz	9219	781	test_9219 abcdefghijklmnopqrstuvwxyz1234567890
test_9229 abcdefghijklmnopqrstuvwxyz	9229	771	test_9229 abcdefghijklmnopqrstuvwxyz1234567890
test_9239 abcdefghijklmnopqrstuvwxyz	9239	761	test_9239 abcdefghijklmnopqrstuvwxyz1234567890
test_9249 abcdefghijklmnopqrstuvwxyz	9249	751	test_9249 abcdefghijklmnopqrstuvwxyz1234567890
test_9259 abcdefghijklmnopqrstuvwxyz	9259	741	test_9259 abcdefghijklmnopqrstuvwxyz1234567890
test_9269 abcdefghijklmnopqrstuvwxyz	9269	731	test_9269 abcdefghijklmnopqrstuvwxyz1234567890
test_9279 abcdefghijklmnopqrstuvwxyz	9279	721	test_9279 abcdefghijklmnopqrstuvwxyz1234567890
test_9289 abcdefghijklmnopqrstuvwxyz	9289	711	test_9289 abcdefghijklmnopqrstuvwxyz1234567890
test_9299 abcdefghijklmnopqrstuvwxyz	9299	701	test_9299 abcdefghijklmnopqrstuvwxyz1234567890
test_9309 abcdefghijklmnopqrstuvwxyz	9309	691	test_9309 abcdefghijklmnopqrstuvwxyz1234567890
test_9319 abcdefghijklmnopqrstuvwxyz	9319	681	test_9319 abcdefghijklmnopqrstuvwxyz1234567890
test_9329 abcdefghijklmnopqrstuvwxyz	9329	671	test_9329 abcdefghijklmnopqrstuvwxyz1234567890
test_9339 abcdefghijklmnopqrstuvwxyz	9339	661	test_9339 abcdefghijklmnopqrstuvwxyz1234567890
test_9349 abcdefghijklmnopqrstuvwxyz	9349	651	test_9349 abcdefghijklmnopqrstuvwxyz1234567890
test_9359 abcdefghijklmnopqrstuvwxyz	9359	641	test_9359 abcdefghijklmnopqrstuvwxyz1234567890
test_9369 abcdefghijklmnopqrstuvwxyz	9369	631	test_9369 abcdefghijklmnopqrstuvwxyz1234567890
test_9379 abcdefghijklmnopqrstuvwxyz	9379	621	test_9379 abcdefghijklmnopqrstuvwxyz1234567890
test_9389 abcdefghijklmnopqrstuvwxyz	9389	611	test_9389 abcdefghijklmnopqrstuvwxyz1234567890
test_9399 abcdefghijklmnopqrstuvwxyz	9399	601	test_9399 abcdefghijklmnopqrstuvwxyz1234567890
test_9409 abcdefghijklmnopqrstuvwxyz	9409	591	test_9409 abcdefghijklmnopqrstuvwxyz1234567890
test_9419 abcdefghijklmnopqrstuvwxyz	9419	581	test_9419 abcdefghijklmnopqrstuvwxyz1234567890
test_9429 abcdefghijklmnopqrstuvwxyz	9429	571	test_9429 abcdefghijklmnopqrstuvwxyz1234567890
test_9439 abcdefghijklmnopqrstuvwxyz	9439	561	test_9439 abcdefghijklmnopqrstuvwxyz1234567890
test_9449 abcdefghijklmnopqrstuvwxyz	9449	551	test_9449 abcdefghijklmnopqrstuvwxyz1234567890
test_9459 abcdefghijklmnopqrstuvwxyz	9459	541	test_9459 abcdefghijklmnopqrstuvwxyz1234567890
test_9469 abcdefghijklmnopqrstuvwxyz	9469	531	test_9469 abcdefghijklmnopqrstuvwxyz1234567890
test_9479 abcdefghijklmnopqrstuvwxyz	9479	521	test_9479 abcdefghijklmnopqrstuvwxyz1234567890
test_9489 abcdefghijklmnopqrstuvwxyz	9489	511	test_9489 abcdefghijklmnopqrstuvwxyz1234567890
test_9499 abcdefghijklmnopqrstuvwxyz	9499	501	test_9499 abcdefghijklmnopqrstuvwxyz1234567890
test_9509 abcdefghijklmnopqrstuvwxyz	9509	491	test_9509 abcdefghijklmnopqrstuvwxyz1234567890
test_9519 abcdefghijklmnopqrstuvwxyz	9519	481	test_9519 abcdefghijklmnopqrstuvwxyz1234567890
test_9529 abcdefghijklmnopqrstuvwxyz	9529	471	test_9529 abcdefghijklmnopqrstuvwxyz1234567890
test_9539 abcdefghijklmnopqrstuvwxyz	9539	461	test_9539 abcdefghijklmnopqrstuvwxyz1234567890
test_9549 abcdefghijklmnopqrstuvwxyz	9549	451	test_9549 abcdefghijklmnopqrstuvwxyz1234567890
test_9559 abcdefghijklmnopqrstuvwxyz	9559	441	test_9559 abcdefghijklmnopqrstuvwxyz1234567890
test_9569 abcdefghijklmnopqrstuvwxyz	9569	431	test_9569 abcdefghijklmnopqrstuvwxyz1234567890
test_9579 abcdefghijklmnopqrstuvwxyz	9579	421	test_9579 abcdefghijklmnopqrstuvwxyz1234567890
test_9589 abcdefghijklmnopqrstuvwxyz	9589	411	test_9589 abcdefghijklmnopqrstuvwxyz1234567890
test_9599 abcdefghijklmnopqrstuvwxyz	9599	401	test_9599 abcdefghijklmnopqrstuvwxyz1234567890
test_9609 abcdefghijklmnopqrstuvwxyz	9609	391	test_9609 abcdefghijklmnopqrstuvwxyz1234567890
test_9619 abcdefghijklmnopqrstuvwxyz	9619	381	test_9619 abcdefghijklmnopqrstuvwxyz1234567890
test_9629 abcdefghijklmnopqrstuvwxyz	9629	371	test_9629 abcdefghijklmnopqrstuvwxyz1234567890
test_9639 abcdefghijklmnopqrstuvwxyz	9639	361	test_9639 abcdefghijklmnopqrstuvwxyz1234567890
test_9649 abcdefghijklmnopqrstuvwxyz	9649	351	test_9649 abcdefghijklmnopqrstuvwxyz1234567890
test_9659 abcdefghijklmnopqrstuvwxyz	9659	341	test_9659 abcdefghijklmnopqrstuvwxyz1234567890
test_9669 abcdefghijklmnopqrstuvwxyz	9669	331	test_9669 abcdefghijklmnopqrstuvwxyz1234567890
test_9679 abcdefghijklmnopqrstuvwxyz	9679	321	test_9679 abcdefghijklmnopqrstuvwxyz1234567890
test_9689 abcdefghijklmnopqrstuvwxyz	9689	311	test_9689 abcdefghijklmnopqrstuvwxyz1234567890
test_9699 abcdefghijklmnopqrstuvwxyz	9699	301	test_9699 abcdefghijklmnopqrstuvwxyz1234567890
test_9709 abcdefghijklmnopqrstuvwxyz	9709	291	test_9709 abcdefghijklmnopqrstuvwxyz1234567890
test_9719 abcdefghijklmnopqrstuvwxyz	9719	281	test_9719 abcdefghijklmnopqrstuvwxyz1234567890
test_9729 abcdefghijklmnopqrstuvwxyz	9729	271	test_9729 abcdefghijklmnopqrstuvwxyz1234567890
test_9739 abcdefghijklmnopqrstuvwxyz	9739	261	test_9739 abcdefghijklmnopqrstuvwxyz1234567890
test_9749 abcdefghijklmnopqrstuvwxyz	9749	251	test_9749 abcdefghijklmnopqrstuvwxyz1234567890
test_9759 abcdefghijklmnopqrstuvwxyz	9759	241	test_9759 abcdefghijklmnopqrstuvwxyz1234567890
test_9769 abcdefghijklmnopqrstuvwxyz	9769	231	test_9769 abcdefghijklmnopqrstuvwxyz1234567890
test_9779 abcdefghijklmnopqrstuvwxyz	9779	221	test_9779 abcdefghijklmnopqrstuvwxyz1234567890
test_9789 abcdefghijklmnopqrstuvwxyz	9789	211	test_9789 abcdefghijklmnopqrstuvwxyz1234567890
test_9799 abcdefghijklmnopqrstuvwxyz	9799	201	test_9799 abcdefghijklmnopqrstuvwxyz1234567890
test_9809 abcdefghijklmnopqrstuvwxyz	9809	191	test_9809 abcdefghijklmnopqrstuvwxyz1234567890
test_9819 abcdefghijklmnopqrstuvwxyz	9819	181	test_9819 abcdefghijklmnopqrstuvwxyz1234567890
test_9829 abcdefghijklmnopqrstuvwxyz	9829	171	test_9829 abcdefghijklmnopqrstuvwxyz1234567890
test_9839 abcdefghijklmnopqrstuvwxyz	9839	161	test_9839 abcdefghijklmnopqrstuvwxyz1234567890
test_9849 abcdefghijklmnopqrstuvwxyz	9849	151	test_9849 abcdefghijklmnopqrstuvwxyz1234567890
test_9859 abcdefghijklmnopqrstuvwxyz	9859	141	test_9859 abcdefghijklmnopqrstuvwxyz1234567890
test_9869 abcdefghijklmnopqrstuvwxyz	9869	131	test_9869 abcdefghijklmnopqrstuvwxyz1234567890
test_9879 abcdefghijklmnopqrstuvwxyz	9879	121	test_9879 abcdefghijklmnopqrstuvwxyz1234567890
test_9889 abcdefghijklmnopqrstuvwxyz	9889	111	test_9889 abcdefghijklmnopqrstuvwxyz1234567890
test_9899 abcdefghijklmnopqrstuvwxyz	9899	101	test_9899 abcdefghijklmnopqrstuvwxyz1234567890
test_9909 abcdefghijklmnopqrstuvwxyz	9909	91	test_9909 abcdefghijklmnopqrstuvwxyz1234567890
test_9919 abcdefghijklmnopqrstuvwxyz	9919	81	test_9919 abcdefghijklmnopqrstuvwxyz1234567890
test_9929 abcdefghijklmnopqrstuvwxyz	9929	71	test_9929 abcdefghijklmnopqrstuvwxyz1234567890
test_9939 abcdefghijklmnopqrstuvwxyz	9939	61	test_9939 abcdefghijklmnopqrstuvwxyz1234567890
test_9949 abcdefghijklmnopqrstuvwxyz	9949	51	test_9949 abcdefghijklmnopqrstuvwxyz1234567890
test_9959 abcdefghijklmnopqrstuvwxyz	9959	41	test_9959 abcdefghijklmnopqrstuvwxyz1234567890
test_9969 abcdefghijklmnopqrstuvwxyz	9969	31	test_9969 abcdefghijklmnopqrstuvwxyz1234567890
test_9979 abcdefghijklmnopqrstuvwxyz	9979	21	test_9979 abcdefghijklmnopqrstuvwxyz1234567890
test_9989 abcdefghijklmnopqrstuvwxyz	9989	11	test_9989 abcdefghijklmnopqrstuvwxyz1234567890
test_9999 abcdefghijklmnopqrstuvwxyz	9999	1	test_9999 abcdefghijklmnopqrstuvwxyz1234567890
select * from t2 where f2>8000 and f3%100=1;
f1	f2	f3	f4
test_8099 abcdefghijklmnopqrstuvwxyz	8099	1901	test_8099 abcdefghijklmnopqrstuvwxyz1234567890
test_8199 abcdefghijklmnopqrstuvwxyz	8199	1801	test_8199 abcdefghijklmnopqrstuvwxyz1234567890
test_8299 abcdefghijklmnopqrstuvwxyz	8299	1701	test_8299 abcdefghijklmnopqrstuvwxyz1234567890
test_8399 abcdefghijklmnopqrstuvwxyz	8399	1601	test_8399 abcdefghijklmnopqrstuvwxyz1234567890
test_8499 abcdefghijklmnopqrstuvwxyz	8499	1501	test_8499 abcdefghijklmnopqrstuvwxyz1234567890
test_8599 abcdefghijklmnopqrstuvwxyz	8599	1401	test_8599 abcdefghijklmnopqrstuvwxyz1234567890
test_8699 abcdefghijklmnopqrstuvwxyz	8699	1301	test_8699 abcdefghijklmnopqrstuvwxyz1234567890
test_8799 abcdefghijklmnopqrstuvwxyz	8799	1201	test_8799 abcdefghijklmnopqrstuvwxyz1234567890
test_8899 abcdefghijklmnopqrstuvwxyz	8899	1101	test_8899 abcdefghijklmnopqrstuvwxyz1234567890
test_8999 abcdefghijklmnopqrstuvwxyz	8999	1001	test_8999 abcdefghijklmnopqrstuvwxyz1234567890
test_9099 abcdefghijklmnopqrstuvwxyz	9099	901	test_9099 abcdefghijklmnopqrstuvwxyz1234567890
test_9199 abcdefghijklmnopqrstuvwxyz	9199	801	test_9199 abcdefghijklmnopqrstuvwxyz1234567890
test_9299 abcdefghijklmnopqrstuvwxyz	9299	701	test_9299 abcdefghijklmnopqrstuvwxyz1234567890
test_9399 abcdefghijklmnopqrstuvwxyz	9399	601	test_9399 abcdefghijklmnopqrstuvwxyz1234567890
test_9499 abcdefghijklmnopqrstuvwxyz	9499	501	test_9499 abcdefghijklmnopqrstuvwxyz1234567890
test_9599 abcdefghijklmnopqrstuvwxyz	9599	401	test_9599 abcdefghijklmnopqrstuvwxyz1234567890
test_9699 abcdefghijklmnopqrstuvwxyz	9699	301	test_9699 abcdefghijklmnopqrstuvwxyz1234567890
test_9799 abcdefghijklmnopqrstuvwxyz	9799	201	test_9799 abcdefghijklmnopqrstuvwxyz1234567890
test_9899 abcdefghijklmnopqrstuvwxyz	9899	101	test_9899 abcdefghijklmnopqrstuvwxyz1234567890
test_9999 abcdefghijklmnopqrstuvwxyz	9999	1	test_9999 abcdefghijklmnopqrstuvwxyz1234567890
drop table t2;
