include/mono_init.inc
DROP TABLE IF EXISTS t1;
connection serv_1;
create table t1(i int primary key, j int, k int , index(j)) engine= eloq;
SET SESSION debug_dbug="+d,eloq;stop_safely_clean_archives;node_id=-1";
insert into t1 values(1,1,1);
insert into t1 values(2,2,2);
insert into t1 values(3,3,3);
insert into t1 values(4,4,4);
insert into t1 values(5,5,5);
insert into t1 values(6,6,6);
insert into t1 values(7,7,7);
insert into t1 values(8,8,8);
insert into t1 values(9,9,9);
insert into t1 values(10,10,10);
insert into t1 values(11,11,11);
insert into t1 values(12,12,12);
insert into t1 values(13,13,13);
insert into t1 values(14,14,14);
insert into t1 values(15,15,15);
insert into t1 values(16,16,16);
select * from t1;
i	j	k
1	1	1
2	2	2
3	3	3
4	4	4
5	5	5
6	6	6
7	7	7
8	8	8
9	9	9
10	10	10
11	11	11
12	12	12
13	13	13
14	14	14
15	15	15
16	16	16
update t1 set j=2;
update t1 set j=3;
delete from t1 where i=10;
delete from t1 where i=11;
SET SESSION debug_dbug="+d,eloq;at_once;node_id=-1;action=NOTIFY_CHECKPOINTER";
explain select * from t1;
id	select_type	table	type	possible_keys	key	key_len	ref	rows	Extra
1	SIMPLE	t1	ALL	NULL	NULL	NULL	NULL	#	
explain select * from t1 force index(j) where j>0;
id	select_type	table	type	possible_keys	key	key_len	ref	rows	Extra
1	SIMPLE	t1	range	j	j	5	NULL	#	Using index condition
begin;
## RESTULT MUST BE:  1,3,1 | 2,3,2 | ...
select * from t1;
i	j	k
1	3	1
2	3	2
3	3	3
4	3	4
5	3	5
6	3	6
7	3	7
8	3	8
9	3	9
12	3	12
13	3	13
14	3	14
15	3	15
16	3	16
select * from t1 force index(j) where j>0;
i	j	k
1	3	1
2	3	2
3	3	3
4	3	4
5	3	5
6	3	6
7	3	7
8	3	8
9	3	9
12	3	12
13	3	13
14	3	14
15	3	15
16	3	16
##restart to clean ccmap
connection serv_2;
# restart
connection serv_3;
# restart
connection serv_3;
begin;
## RESTULT MUST BE:  1,3,1 | 2,3,2 | ...
select * from t1;
i	j	k
1	3	1
2	3	2
3	3	3
4	3	4
5	3	5
6	3	6
7	3	7
8	3	8
9	3	9
12	3	12
13	3	13
14	3	14
15	3	15
16	3	16
select * from t1 force index(j) where j>0;
i	j	k
1	3	1
2	3	2
3	3	3
4	3	4
5	3	5
6	3	6
7	3	7
8	3	8
9	3	9
12	3	12
13	3	13
14	3	14
15	3	15
16	3	16
connection serv_1;
SET SESSION debug_dbug="+d,eloq;stop_safely_clean_archives;node_id=-1";
## RESTULT MUST BE:  # 1,3,1 | 2,3,2 | ...
select * from t1 force index(j) where j>0;
i	j	k
1	3	1
2	3	2
3	3	3
4	3	4
5	3	5
6	3	6
7	3	7
8	3	8
9	3	9
12	3	12
13	3	13
14	3	14
15	3	15
16	3	16
SET SESSION debug_dbug="+d,eloq;checkpointer_skip_ckpt;node_id=-1";
connection serv_2;
update t1 set j=4;
update t1 set j=5;
## RESTULT MUST BE:   # 1,5,1 | 2,5,2 | ...
select * from t1 force index(j) where j>0;
i	j	k
1	5	1
2	5	2
3	5	3
4	5	4
5	5	5
6	5	6
7	5	7
8	5	8
9	5	9
12	5	12
13	5	13
14	5	14
15	5	15
16	5	16
connection serv_1;
## RESTULT MUST BE:  # 1,3,1 | 2,3,2 | ...
select * from t1 force index(j) where j>0;
i	j	k
1	3	1
2	3	2
3	3	3
4	3	4
5	3	5
6	3	6
7	3	7
8	3	8
9	3	9
12	3	12
13	3	13
14	3	14
15	3	15
16	3	16
connection serv_3;
## RESTULT MUST BE:  # 1,3,1 | 2,3,2 | ...
select * from t1 force index(j) where j>0;
i	j	k
1	3	1
2	3	2
3	3	3
4	3	4
5	3	5
6	3	6
7	3	7
8	3	8
9	3	9
12	3	12
13	3	13
14	3	14
15	3	15
16	3	16
##restart serv_2 to triger RedoLogReplay
connection serv_2;
# restart
## RESTULT MUST BE:  1,5,1 | 2,5,2 | ...
select * from t1 force index(j) where j>0;
i	j	k
1	5	1
2	5	2
3	5	3
4	5	4
5	5	5
6	5	6
7	5	7
8	5	8
9	5	9
12	5	12
13	5	13
14	5	14
15	5	15
16	5	16
connection serv_1;
## RESTULT MUST BE:  # 1,3,1 | 2,3,2 | ...
select * from t1 force index(j) where j>0;
i	j	k
1	3	1
2	3	2
3	3	3
4	3	4
5	3	5
6	3	6
7	3	7
8	3	8
9	3	9
12	3	12
13	3	13
14	3	14
15	3	15
16	3	16
SET SESSION debug_dbug="-d,eloq;checkpointer_skip_ckpt;node_id=-1";
SET SESSION debug_dbug="+d,eloq;at_once;node_id=-1;action=NOTIFY_CHECKPOINTER";
## RESTULT MUST BE:  # 1,3,1 | 2,3,2 | ...
select * from t1;
i	j	k
1	3	1
2	3	2
3	3	3
4	3	4
5	3	5
6	3	6
7	3	7
8	3	8
9	3	9
12	3	12
13	3	13
14	3	14
15	3	15
16	3	16
select * from t1 force index(j) where j>0;
i	j	k
1	3	1
2	3	2
3	3	3
4	3	4
5	3	5
6	3	6
7	3	7
8	3	8
9	3	9
12	3	12
13	3	13
14	3	14
15	3	15
16	3	16
select * from t1 where i=2;
i	j	k
2	3	2
select * from t1 where i=6;
i	j	k
6	3	6
commit;
connection serv_1;
# restart
## RESTULT MUST BE:  1,5,1 | 2,5,2 | ...
select * from t1 force index(j) where j>0;
i	j	k
1	5	1
2	5	2
3	5	3
4	5	4
5	5	5
6	5	6
7	5	7
8	5	8
9	5	9
12	5	12
13	5	13
14	5	14
15	5	15
16	5	16
connection serv_3;
## RESTULT MUST BE:  # 1,3,1 | 2,3,2 | ...
select * from t1 force index(j) where j>0;
i	j	k
1	3	1
2	3	2
3	3	3
4	3	4
5	3	5
6	3	6
7	3	7
8	3	8
9	3	9
12	3	12
13	3	13
14	3	14
15	3	15
16	3	16
connection serv_2;
begin;
## RESTULT MUST BE:  1,5,1 | 2,5,2 | ...
select * from t1 force index(j) where j>0;
i	j	k
1	5	1
2	5	2
3	5	3
4	5	4
5	5	5
6	5	6
7	5	7
8	5	8
9	5	9
12	5	12
13	5	13
14	5	14
15	5	15
16	5	16
connection serv_1;
SET SESSION debug_dbug="+d,eloq;checkpointer_skip_ckpt;node_id=-1";
update t1 set j=6;
# restart
## RESTULT MUST BE:  1,6,1 | 2,6,2 | ...
select * from t1 force index(j) where j>0;
i	j	k
1	6	1
2	6	2
3	6	3
4	6	4
5	6	5
6	6	6
7	6	7
8	6	8
9	6	9
12	6	12
13	6	13
14	6	14
15	6	15
16	6	16
connection serv_2;
## RESTULT MUST BE:  1,5,1 | 2,5,2 | ...
select * from t1 force index(j) where j>0;
i	j	k
1	5	1
2	5	2
3	5	3
4	5	4
5	5	5
6	5	6
7	5	7
8	5	8
9	5	9
12	5	12
13	5	13
14	5	14
15	5	15
16	5	16
commit;
connection serv_3;
## RESTULT MUST BE:  # 1,3,1 | 2,3,2 | ...
select * from t1 force index(j) where j>0;
i	j	k
1	3	1
2	3	2
3	3	3
4	3	4
5	3	5
6	3	6
7	3	7
8	3	8
9	3	9
12	3	12
13	3	13
14	3	14
15	3	15
16	3	16
commit;
## RESTULT MUST BE:  1,6,2 | 2,6,2 | ...
select * from t1;
i	j	k
1	6	1
2	6	2
3	6	3
4	6	4
5	6	5
6	6	6
7	6	7
8	6	8
9	6	9
12	6	12
13	6	13
14	6	14
15	6	15
16	6	16
select * from t1 force index(j) where j>0;
i	j	k
1	6	1
2	6	2
3	6	3
4	6	4
5	6	5
6	6	6
7	6	7
8	6	8
9	6	9
12	6	12
13	6	13
14	6	14
15	6	15
16	6	16
drop table t1;
