include/mono_init.inc
DROP TABLE IF EXISTS t1;
connection serv_1;
create table t1(i int primary key, j int) engine=eloq;
insert into t1 values(1,1);
insert into t1 values(2,2);
insert into t1 values(3,3);
insert into t1 values(4,4);
insert into t1 values(5,5);
select * from t1;
i	j
1	1
2	2
3	3
4	4
5	5
SET SESSION debug_dbug="+d,eloq;checkpointer_skip_ckpt;node_id=-1";
SET SESSION debug_dbug="+d,eloq;after_write_log;node_id=0;action=panic";
update t1 set j = 0 where i > 0;
ERROR HY000: Lost connection to server during query
connection serv_2;
update t1 set j = 1 where i > 0;
select * from t1;
i	j
1	1
2	1
3	1
4	1
5	1
drop table t1;
SET SESSION debug_dbug="-d,eloq;after_write_log";
SET SESSION debug_dbug="-d,eloq;checkpointer_skip_ckpt;node_id=-1";
