set @@default_storage_engine= eloq;
select @@default_storage_engine;
@@default_storage_engine
ELOQ
DROP TABLE IF EXISTS t1;
SET SESSION debug_dbug="+d,eloq;checkpointer_skip_ckpt;node_id=-1";
SET SESSION debug_dbug="+d,eloq;stop_safely_clean_archives;";
create table t1(i int primary key, j int) engine= eloq;
insert into t1 values(1,1);
insert into t1 values(2,2);
insert into t1 values(3,3);
insert into t1 values(4,4);
insert into t1 values(5,5);
insert into t1 values(7,7);
insert into t1 values(8,8);
select * from t1;
i	j
1	1
2	2
3	3
4	4
5	5
7	7
8	8
set session transaction isolation level repeatable read;
select @@tx_isolation;
@@tx_isolation
REPEATABLE-READ
connect  conn-tx1,localhost,root,,test,$MONO1_PORT;
set session transaction isolation level repeatable read;
select @@tx_isolation;
@@tx_isolation
REPEATABLE-READ
begin;
select * from t1 where i=1;
i	j
1	1
select * from t1 where i=2;
i	j
2	2
select * from t1 where i=3;
i	j
3	3
select * from t1 where i=4;
i	j
4	4
select * from t1 where i=5;
i	j
5	5
select * from t1 where i=7;
i	j
7	7
select * from t1 where i=8;
i	j
8	8
connection default;
update t1 set j=21;
update t1 set j=22;
delete from t1 where i=1;
delete from t1 where i=2;
delete from t1 where i=3;
delete from t1 where i=5;
select * from t1;
i	j
4	22
7	22
8	22
connection conn-tx1;
select * from t1 where i=7;
i	j
7	7
select * from t1 where i=8;
i	j
8	8
select * from t1 where i=1;
i	j
1	1
select * from t1 where i=2;
i	j
2	2
select * from t1 where i=3;
i	j
3	3
select * from t1 where i=4;
i	j
4	4
select * from t1 where i=5;
i	j
5	5
connection default;
SET SESSION debug_dbug="+d,eloq_test;ccentry_clean_test;./test/t1;2;";
SET SESSION debug_dbug="+d,eloq_test;ccentry_clean_test;./test/t1;5;";
connection conn-tx1;
select * from t1 where i=7;
i	j
7	7
select * from t1 where i=8;
i	j
8	8
select * from t1 where i=1;
i	j
1	1
select * from t1 where i=2;
i	j
2	2
select * from t1 where i=3;
i	j
3	3
select * from t1 where i=4;
i	j
4	4
select * from t1 where i=5;
i	j
5	5
select * from t1;
i	j
1	1
2	2
3	3
4	4
5	5
7	7
8	8
commit;
connection default;
drop table t1;
connection default;
set session transaction isolation level read committed;
select @@tx_isolation;
@@tx_isolation
READ-COMMITTED
create table t1(i int primary key, j int) engine= eloq;
insert into t1 values(1,1);
insert into t1 values(2,2);
insert into t1 values(3,3);
insert into t1 values(4,4);
insert into t1 values(5,5);
insert into t1 values(7,7);
insert into t1 values(8,8);
select * from t1;
i	j
1	1
2	2
3	3
4	4
5	5
7	7
8	8
connection conn-tx1;
set session transaction isolation level read committed;
select @@tx_isolation;
@@tx_isolation
READ-COMMITTED
begin;
select * from t1 where i=1;
i	j
1	1
select * from t1 where i=2;
i	j
2	2
select * from t1 where i=3;
i	j
3	3
select * from t1 where i=4;
i	j
4	4
select * from t1 where i=5;
i	j
5	5
select * from t1 where i=7;
i	j
7	7
select * from t1 where i=8;
i	j
8	8
connection default;
update t1 set j=21;
update t1 set j=22;
delete from t1 where i=1;
delete from t1 where i=2;
delete from t1 where i=3;
delete from t1 where i=5;
select * from t1;
i	j
4	22
7	22
8	22
connection conn-tx1;
select * from t1 where i=7;
i	j
7	22
select * from t1 where i=8;
i	j
8	22
select * from t1 where i=1;
i	j
select * from t1 where i=2;
i	j
select * from t1 where i=3;
i	j
select * from t1 where i=4;
i	j
4	22
select * from t1 where i=5;
i	j
connection default;
SET SESSION debug_dbug="+d,eloq_test;ccentry_clean_test;./test/t1;2;";
SET SESSION debug_dbug="+d,eloq_test;ccentry_clean_test;./test/t1;5;";
connection conn-tx1;
select * from t1 where i=7;
i	j
7	22
select * from t1 where i=8;
i	j
8	22
select * from t1 where i=1;
i	j
select * from t1 where i=2;
i	j
select * from t1 where i=3;
i	j
select * from t1 where i=4;
i	j
4	22
select * from t1 where i=5;
i	j
select * from t1;
i	j
4	22
7	22
8	22
commit;
connection default;
SET SESSION debug_dbug="-d,eloq;stop_safely_clean_archives;";
SET SESSION debug_dbug="-d,eloq;checkpointer_skip_ckpt;node_id=-1";
drop table t1;
