set @@default_storage_engine= eloq;
select @@default_storage_engine;
@@default_storage_engine
ELOQ
DROP TABLE IF EXISTS t1;
SET SESSION debug_dbug="+d,eloq;checkpointer_skip_ckpt;node_id=-1";
SET SESSION debug_dbug="+d,eloq;stop_safely_clean_archives;";
CREATE TABLE t1 (
id INT AUTO_INCREMENT PRIMARY KEY,
i INT UNIQUE KEY,
j INT
);
insert into t1 (i,j) values(1,1);
insert into t1 (i,j) values(2,2);
insert into t1 (i,j) values(3,3);
insert into t1 (i,j) values(4,4);
insert into t1 (i,j) values(5,5);
insert into t1 (i,j) values(6,6);
insert into t1 (i,j) values(7,7);
insert into t1 (i,j) values(8,8);
select * from t1;
id	i	j
1	1	1
2	2	2
3	3	3
4	4	4
5	5	5
6	6	6
7	7	7
8	8	8
set session transaction isolation level repeatable read;
select @@tx_isolation;
@@tx_isolation
REPEATABLE-READ
connect  conn-tx1,localhost,root,,test,$MONO1_PORT;
set session transaction isolation level repeatable read;
select @@tx_isolation;
@@tx_isolation
REPEATABLE-READ
begin;
select * from t1 where i=1;
id	i	j
1	1	1
select * from t1 where i=2;
id	i	j
2	2	2
select * from t1 where i=3;
id	i	j
3	3	3
select * from t1 where i=4;
id	i	j
4	4	4
select * from t1 where i=5;
id	i	j
5	5	5
select * from t1 where i=6;
id	i	j
6	6	6
select * from t1 where i=7;
id	i	j
7	7	7
select * from t1 where i=8;
id	i	j
8	8	8
connection default;
update t1 set j=21;
update t1 set j=22;
delete from t1 where i=1;
delete from t1 where i=2;
delete from t1 where i=3;
delete from t1 where i=5;
select * from t1;
id	i	j
4	4	22
6	6	22
7	7	22
8	8	22
connection conn-tx1;
select * from t1 where i=1;
id	i	j
1	1	1
select * from t1 where i=2;
id	i	j
2	2	2
select * from t1 where i=3;
id	i	j
3	3	3
select * from t1 where i=4;
id	i	j
4	4	4
select * from t1 where i=5;
id	i	j
5	5	5
select * from t1 where i=6;
id	i	j
6	6	6
select * from t1 where i=7;
id	i	j
7	7	7
select * from t1 where i=8;
id	i	j
8	8	8
connection default;
SET SESSION debug_dbug="+d,eloq_test;sk_archives_clean_test;./test/t1;i;1;1;";
SET SESSION debug_dbug="+d,eloq_test;sk_archives_clean_test;./test/t1;i;2;2;";
SET SESSION debug_dbug="+d,eloq_test;sk_archives_clean_test;./test/t1;i;3;3;";
SET SESSION debug_dbug="+d,eloq_test;sk_archives_clean_test;./test/t1;i;5;5;";
connection conn-tx1;
select * from t1 where i=1;
id	i	j
1	1	1
select * from t1 where i=2;
id	i	j
2	2	2
select * from t1 where i=3;
id	i	j
3	3	3
select * from t1 where i=4;
id	i	j
4	4	4
select * from t1 where i=5;
id	i	j
5	5	5
select * from t1 where i=6;
id	i	j
6	6	6
select * from t1 where i=7;
id	i	j
7	7	7
select * from t1 where i=8;
id	i	j
8	8	8
select * from t1;
id	i	j
1	1	1
2	2	2
3	3	3
4	4	4
5	5	5
6	6	6
7	7	7
8	8	8
connection default;
SET SESSION debug_dbug="+d,eloq_test;sk_ccentry_clean_test;./test/t1;i;2;2;";
SET SESSION debug_dbug="+d,eloq_test;sk_ccentry_clean_test;./test/t1;i;5;5;";
connection conn-tx1;
select * from t1 where i=1;
id	i	j
1	1	1
select * from t1 where i=2;
id	i	j
2	2	2
select * from t1 where i=3;
id	i	j
3	3	3
select * from t1 where i=4;
id	i	j
4	4	4
select * from t1 where i=5;
id	i	j
5	5	5
select * from t1 where i=6;
id	i	j
6	6	6
select * from t1 where i=7;
id	i	j
7	7	7
select * from t1 where i=8;
id	i	j
8	8	8
select * from t1;
id	i	j
1	1	1
2	2	2
3	3	3
4	4	4
5	5	5
6	6	6
7	7	7
8	8	8
commit;
connection default;
SET SESSION debug_dbug="-d,eloq;stop_safely_clean_archives;";
SET SESSION debug_dbug="-d,eloq;checkpointer_skip_ckpt;node_id=-1";
drop table t1;
